url,business_name,contact_email,phone,intro_offers,pricing_packages,num_instructors,instructor_names,instructor_details,all_certifications,class_types,amenities,has_reformers,has_maternity_classes,has_parking,requires_javascript,quality_score,mobile_responsive,load_speed_score,info_findability_score,design_quality_score,contact_accessibility_score,pricing_transparency_score,pain_points,improvement_potential,rebuild_priority,pages_scraped,scraped_at,ai_enhanced,error
https://www.trimetricsphysio.com/,Trimetrics Physiotherapy,info@trimetricsphysio.com,(604) 982-0366,None available,Contact for pricing,0,Not listed,Not listed,Not specified,Not specified,Parking,No,No,Yes,No,80,Yes,75,80,70,85,50,Pricing hidden behind multiple clicks; No business hours listed; Some images could be better optimized for faster loading,Medium,Low,1,2025-07-25 12:01:25,Yes,
http://www.vipfitnessandlifestyle.com/,VIP Fitness & Lifestyle,info@VIPFIT.ca,(778) 866-6757,None available,Price varies Group | Price varies Package | Price varies Drop-in | Price varies Package (8x) | Price varies Monthly,0,Not listed,Not listed,Not specified,"Strength Circuits, Boxing, Yoga, Barre",Parking,No,No,Yes,No,76,Yes,65,70,75,80,50,Pricing hidden behind multiple clicks; No business hours listed; Slow loading images,Medium,Low,1,2025-07-25 12:02:18,Yes,
https://houseconcepts.com/,House Concepts,hello@houseconcepts.com,(604) 566-8980,$100 Trial | $30 Trial | $280 Private,$38 Group | $165 Group (5x) | $320 Group (10x) | $580 Group (20x) | $820 Group (30x) | $1250 Group (50x) | $150 Package (3x) | $280 Package (6x) | $480 Package (12x) | $899 Package (24x) | $220 Monthly (8x) | $325 Monthly (50x) | $425 Package | $650 Monthly | $140 Private | $825 Private (6x) | $1518 Private (12x) | $2640 Private (24x) | $5016 Private (48x) | $2000 Private,0,Not listed,Not listed,Not specified,"Reformer, Mat, Tower, Chair","Parking, Showers, Lockers, Retail Shop",Yes,No,Yes,No,80,Yes,70,80,75,85,60,Pricing hidden behind multiple clicks; No clear business hours listed,Medium,Low,4,2025-07-25 12:03:22,Yes,
https://www.clubpilates.com/kitsilano/,Club Pilates Kitsilano,kitsilano@clubpilates.com,(604) 336-9676,$0 Trial,$99 Package (4x) | $179 Package (8x) | $199 Monthly,7,"Nadia, Alicja, Anh, Alexandra, Rose, Parya, Juliana S",Nadia | Alicja | Anh | Alexandra | Rose | Parya | Juliana S,Not specified,"Reformer, Mat, Tower, Chair, Intro Class, Cardio Sculpt, Control, Suspend, Restore, Center + Balance, F.I.T., Teen","Parking, Showers, Lockers, Retail Shop",Yes,No,Yes,No,84,Yes,75,85,80,90,60,Pricing hidden behind multiple clicks; Some images may not be optimized for faster loading,Medium,Low,6,2025-07-25 12:04:54,Yes,
http://vibelounge.ca/,Vibe Lounge,info@vibelounge.ca,(604) 505-4246,$299 Package (3x) | $239 Private,$1499 Package (12x),4,"Sandrine, Arad, Stephanie, Elena","Sandrine (Certified Personal Trainer, Postpartum Corrective Exercise Specialist, Precision Nutrition Level 1, Functional Movement Level 1 & 2, Classical Pilates) | Arad (Certified Personal Trainer, Functional Movement Level 1 & 2, Precision Nutrition Level 1, Bodybuilding) | Stephanie (Mat Pilates, Certified Personal Trainer, Natural Nutrition Clinical Practitioner, Precision Nutrition Level 1, Functional Movement Level 1 & 2, BKIN) | Elena (STOTT Pilates Mat Plus, Bachelor of Cognitive Science, Diveboard Coach)","BKIN, Bachelor of Cognitive Science, Bodybuilding, Certified Personal Trainer, Classical Pilates, Diveboard Coach, Functional Movement Level 1 & 2, Mat Pilates, Natural Nutrition Clinical Practitioner, Postpartum Corrective Exercise Specialist, Precision Nutrition Level 1, STOTT Pilates Mat Plus",Not specified,"Parking, Showers, Lockers, Retail Shop",Yes,No,Yes,No,73,Yes,70,60,75,65,50,Pricing hidden behind multiple clicks; No clear contact information; No business hours listed,Medium,Low,5,2025-07-25 12:05:52,Yes,
http://www.qubecore.com/,QubeCore Sports & Rehab,info@qubecore.com,(604) 210-2274,None available,Contact for pricing,0,Not listed,Not listed,Not specified,Not specified,Parking,No,No,Yes,Yes,80,Yes,70,80,75,90,50,Pricing hidden behind multiple clicks; No clear business hours listed,Medium,Low,1,2025-07-25 12:07:24,Yes,
